161555,1-2,月1,生理学,西丸 広史,2,専門教育科目(必修) 生物系薬学,2,杉 大講義室,第1週 総論\\n第2週 神経の興奮・伝導およびシナプスの機能\\n第3週 本能行動と自律神経系の機能\\n第4週 筋と運動系の機能\\n第5週 感覚機能(1)\\n第6週 感覚機能(2)\\n第7週 高次脳機能\\n第8週 呼吸系の機能\\n第9週 循環系(1)\\n第10週 循環系(2)\\n第11週 血液系\\n第12週 内分泌系\\n第13週 消化・吸収(1)\\n第14週 消化・吸収(2)\\n第15週 腎と体液,期末試験によって評価する(100%)。受験資格として授業の2/3以上の出席が必要である。筆記試験(選択肢問題や論述問題)により学力を評価し、60点を合格ラインとする。なお必要に応じて、再評価試験を(原則1回だけ)行う。,本教科はコアカリキュラムC7 (1)ヒトの成り立ちおよび(2)生体機能の調節に対応し、薬剤師国家試験出題基準では、I基礎薬学の大項目「3. 生体の構造と機能」中の中項目「C.器官の構造と機能」に対応する。
161702,1-2,月1,無機化学,友廣 岳則,3,専門教育科目(選択),2,杉 403講義室,プリントなどを使って講義する。\\n第1週	元素の周期律と原子構造\\n第2週	物質の構造、典型元素概論\\n第3週	典型元素の化合物\\n第4週	遷移金属とd軌道\\n第5週	Werner 型錯体\\n第6週	静電結晶場理論\\n第7週	配位子場理論\\n第8週	18電子則\\n第9週	生体内金属イオンの特性\\n第10週	医療における無機化学\\n第11週	生体分子による金属イオンの濃度制御\\n第12週	生体分子と金属イオンの関わり\\n第13週	金属タンパク質による基質の活性化\\n第14週	酸素運搬体\\n第15週	酸化還元に関わる金属タンパク質\\n定期試験,期末試験(100%)により評価する。,コアカリC-1-1 化学結合と化学物質・生体高分子間相互作用、C-3-5 無機化合物・錯体、に対応する。旧コアカリでは、C1(1)物質の構造、C3 (5) 無機化合物・錯体の構造と性質、C4 (1) 医薬品の標的となる生体分子の構造と化学的な性質、C6 (2)生命現象を担う分子、(3) 生命活動を担うタンパク質に対応する。7コマ相当のアドバンスト教育内容を含む(大学独自科目)。
161706,1-2,月2,構造生物学,水口 峰之,3,専門教育科目(選択),2,杉 403講義室,第1週 タンパク質立体構造の基礎(1)\\n第2週 タンパク質立体構造の基礎(2)\\n第3週 タンパク質立体構造の基礎(3)\\n第4週 タンパク質立体構造と生命現象(1)\\n第5週 タンパク質立体構造と生命現象(2)\\n第6週 タンパク質立体構造と生命現象(3)\\n第7週 タンパク質の結晶化\\n第8週 タンパク質のX線結晶構造解析\\n第9週 電子顕微鏡\\n第10週 タンパク質立体構造の構築原理(1)\\n第11週 タンパク質立体構造の構築原理(2)\\n第12週 タンパク質立体構造の構築原理(3)\\n第13週 タンパク質立体構造の構築原理(4)\\n第14週 タンパク質構造と薬\\n第15週 NMR、画像診断\\n(独自項目を含む),期末試験を100点満点とし、60点以上を合格とする。\\n「秀(S)」と「優(A)」の合計人数が30~40%程度となるように補正を行う。,コアカリキュラムC1 物質の物理的性質(1)、C2 化学物質の分析(4)(6)、C4 生体分子・医薬品の化学による理解(1)(2)(3)、C6 生命現象の基礎(2)(3)に対応する。
161730,1-2,月3,企業薬剤師育成学,恒枝 宏史,3,専門教育科目(必修) 基盤教育,1,杉 102講義室,富山県内の製薬企業における企業薬剤師の役割の動画を視聴し、グループディスカッションを通して理解を深める。\\n企業薬剤師の役割(1)\\n企業薬剤師の役割(2)\\n企業薬剤師の役割(3)\\n企業薬剤師の役割(4)\\n企業薬剤師の役割(5)\\n企業薬剤師の役割(6)\\n企業薬剤師の役割(7)\\n企業薬剤師の役割(8)まとめ,学習意欲(積極的な受講態度、質疑への参加など)(50%)とレポート(50%)により、総合的に成績を判定する。,本講義はコアカリのB-1、B-4に対応する大学独自科目であり、製薬企業概論等で学修した薬学と社会のつながりに関するアドバンスト教育である(旧(H25)コアカリのB(1);  B(2)1~3;  B(3)2に対応)。本講義では、教材動画の視聴後にグループディスカッションを行う問題解決型学習を実施する。
161735,1-2,月3,臨床データ解析入門,田口 雅登,3,専門教育科目(選択),1,杉 403講義室,1) 講義(1) 臨床試験デザイン\\n2) 講義(2) メタアナリシス\\n3) 講義(3) 臨床データ解析の代表的な手法(多群比較、回帰と相関分析ほか)\\n4) 演習(1) 非モデル解析に基づく薬物動態解析の基礎演習\\n5) 演習(2) ビッグデータや公共データベースの活用による研究事例(1)\\n6) 演習(3) ビッグデータや公共データベースの活用による研究事例(2)\\n7) 演習(4) 薬剤使用状況のレセプトデータベース活用\\n8) 演習(5) 医療関連データベース活用・全体のまとめ,各演習の後に、提出するレポートによって成績評価を行う(100%)。臨床データ解析の多様性やそれらの結果をどのように解釈できるか、或いはどのような医療データの応用が可能かを論じた場合には、評価の重みづけをします。,本教科は主として薬学教育モデル・コア・カリキュラム(R4年度改訂版)のA7; B-5-1; B-5-2; D-3-4; F-1-1 2); 3); 5); F-3-2 3); 4)  に対応する。
162504,1-2,月2,生薬学,李 貞範,2,専門教育科目(必修) 和漢薬学,2,杉 大講義室,第1回  生薬学の学習目標と生薬総則・生薬試験法\\n第2回  代表的な生薬成分の構造と生合成経路(1)\\n第3回  代表的な生薬成分の構造と生合成経路(2)\\n第4回  日本薬局法収載生薬(1)アルカロイド含有生薬\\n第5回  日本薬局法収載生薬(2)アルカロイド含有生薬\\n第6回  日本薬局法収載生薬(3)イソプレノイド含有生薬\\n第7回  日本薬局法収載生薬(4)イソプレノイド含有生薬\\n第8回  日本薬局法収載生薬(5)フラボノイド・キノン・精油含有生薬\\n第9回  日本薬局法収載生薬(6)食用生薬と薬食同源\\n第10回  日本薬局法収載生薬(7)動物・鉱物・菌類由来重要生薬\\n第11回  漢方医学の基礎と代表的な漢方処方配合生薬\\n第12回  代表的な漢方処方の適応症と配合生薬(1)\\n第13回  代表的な漢方処方の適応症と配合生薬(2)\\n第14回  代表的な漢方処方の適応症と配合生薬(3)\\n第15回  漢方薬や生薬の副作用,期末試験により合否を判定する(100%)。\\n評価は、「達成目標」に掲げた項目を達成しているものを60点以上、「達成目標」に掲げた項目を達成した上で、良好な成果を収めているものを70点以上、優れた成果を収めているものを80点以上、特に優れた成果を収めているものを90点以上とする。,第1週〜第10週の内容は令和4年度改訂薬学教育モデルコアカリキュラムのC-5「薬学の中の生薬学・天然物科学」のC-5-1「生薬学・天然物化学の基礎」に対応し、一部はC-5-2およびC-2-3-2)の内容を含む。また第11週〜第15週は、D-2「薬物治療につながる薬理・病態」の D-2-19「漢方療法」に対応する。詳細は「授業計画詳細」に記載。
162720,1-2,月2,保険薬局学,藤 秀人,4,専門教育科目(必修) 臨床薬学,2,杉 402講義室,第1回 薬剤師概論(薬学の歴史、薬剤師の使命・現在地、かかりつけ薬局、かかりつけ薬剤師)\\n第2回 調剤技術1(処方箋及び記載内容の取り決めなど)\\n第3回 調剤技術2(処方箋の読み方、記載方法など)\\n第4回 調剤技術3(処方せんに基づく計数調剤、計量調剤)\\n第5回 調剤技術4(錠剤、カプセル剤、散薬の調剤基礎手技、注意点)\\n第6回 調剤技術5(内用液剤の調剤基礎手技、注意点)\\n第7回 調剤技術6(軟膏、外用剤などの調剤基礎手技、注意点)\\n第8回 調剤技術7(医薬品情報、処方薬監査、疑義照会、調剤薬鑑査)\\n第9回 調剤技術8(薬剤の交付、服薬指導、コミュニケーションスキル)\\n第10回 調剤技術9(薬歴管理、SOAP、書類の保管、調剤事故、防止対策、ミス防止)\\n第11回 製剤の特徴と使用法など1(経口など)\\n第12回 製剤の特徴と使用法など2(経口など)\\n第13回 製剤の特徴と使用法など3(口腔、自己注射など)\\n第14回 製剤の特徴と使用法など4(気管支、目、鼻、直腸など)\\n第15回 製剤の特徴と使用法など5(皮膚、生薬、麻薬など)、まとめ,期末試験(100%)の総合点で成績評価を行う。,本科目は、コアカリキュラムA-(1)-11-8、41-4、(2)-21;  6;  7、(4)-1-4、(5)-31; 2、41B-(2)-31-3、(4)-14、E-(1)-7-1;  (9)-1-8、F-(1)21-3;  31;  2、F-(2)-11、21-6、32、34、47;  8 、51-5、8;  9、F-(3)-11 、(4)-11;  2に対応しています。
168003,1-2,月3,和漢医薬学演習,条 美智子,4,専門教育科目(自由),2,杉 402講義室,授業は小人数によるチーム基盤型学習形式で実施する。\\n1~10  漢方診療における症例を提示し、提示症例についてグループ内で討議し、提示内容と追加質問事項により和漢医薬学的病態を判断し、使用されるべき和漢薬を選択するとともに、その調剤・副反応として注意すべき事項を検討する(担当:条)\\n11~14  グループ毎に提示された和漢医薬学に関わる課題をグループ内で討議し、発表準備を行う(担当:条)\\n15  各グループが課題について発表し、全体で討論する(担当:条),定期試験は実施せず、「受講態度と学習姿勢」並びに「提出レポートの内容」を9:1として評価する。,本科目は、「卓越薬学教育プログラム和漢薬コース」履修対象科目であり、問題解決型学習です。 本教科はコアカリキュラムE医療薬学 E2 薬理・病態・薬物治療 (10)医療の中の漢方薬 1 漢方薬の基礎・2 漢方薬の応用・3 漢方薬の注意点、薬剤師国家試験出題基準VII実務 薬剤師業務に対応しています。
162436,3-4,月3,専門英語II,水口 峰之,3,専門教育科目(必修) 基盤教育,1,杉 各研究室,研究室で実施する研究内容に関連した基礎的な英語論文を学習し、各分野でのテクニカルタームを習得するとともにその内容についてプレゼンテーションし、学生-教員間および学生同士のディスカッションすることで、薬学部生として必要な英語力を高める。(問題解決型学習・大学独自項目)\\n第1-8週:研究室による授業\\n第1-15週:英語学習システムによるオンデマンド学修(TOEIC 演習)自学演習,1)「英語を用いたコミュニケーション能力および自己表現能力」および「ディスカッションを通じた内容の理解」を総合的に評価する。\\n2) 英語学習システムによるオンデマンド学修:英語学習システムにおいて、自分の実力に対応したコースを選択し、演習を行なった上で、模擬試験を受験する。Moodleに提出した試験結果のスコアをもとに評価する。\\n◯研究室による授業 (65%)、◯英語学習システムによるオンデマンド学修 (25%)、◯TOEIC-IP テストスコア (10%)。\\n3年次後学期大学主催の TOEIC-IP テストスコア(本 TOEIC スコア以外は認めない)が 449点以下の場合、「専門英語 II」の単位を認定しない。しかし、自分自身で TOEIC-IP テストあるいは TOEIC-L&R テストを再受験し、2月初旬の授業・補講・試験期間の最終日までに 450点以上の成績スコアを学務課に提出できれば、単位認定の対象とする。\\n専門英語 II の単位が認められなかった場合、その後に提出した TOEIC 再受験結果のスコアをもとに (10%) の点数を換算し、これに正規の授業期間に行った研究室による授業 (65%) および英語学習システムによるオンデマンド学修 (25%) の点数を加えて成績 (可あるいは不可) を評価する。\\n◯研究室による授業\\n評価基準\\n・英語力、および課題への取り組み態度等(遅刻することなく出席することを含む)\\n・発表、質疑応答等への参加意欲、態度\\n・グループ内でのディスカッションへの参加意欲、態度\\n◯英語学習システムによるオンデマンド学修\\n英語学習システムにおいて、自分の実力に対応したコースを選択し、演習を行なった上で、模擬試験を受験する。Moodle に提出した試験結果のスコアをもとに評価する。,学習方法は小グループ学習(PBL) であり、英語でのディスカッションやプレゼンテーションを頻繁におこなう。\\n専門分野ならびに薬学関連の職業に関する内容を含み、それらの関係を理解するキャリア教育と位置付ける。\\n本講義は、問題解決型学習であり、本学独自教育である。
162552,3-4,月2,人体機能形態学,一條 裕之,2,専門教育科目(必修) 生物系薬学,2,杉 大講義室,1)オリエンテーション; 皮膚と膜(一條裕之)\\n2)骨格系(一條裕之)\\n3)筋肉と運動(一條裕之)\\n4−5)運動系実習(一條裕之、中村友也、楠井優香):能動的学修\\n6)循環系(一條裕之)\\n7)神経系1(一條裕之)\\n8)神経系2(一條裕之)\\n9−10)神経系実習(一條裕之、中村友也、楠井優香):能動的学修\\n11)内分泌系(和田努)\\n12)泌尿器系と生殖器系(伊藤哲史)\\n13)血液系(新田淳美)\\n14)呼吸器系と消化器系(岡部素典、伊藤哲史)\\n15)まとめ(一條裕之)\\n講義の資料はMoodleで提示して配布します(印刷して配布する場合もあります)。講義の最後に復習問題と授業についての質問とその回答をMoodleで求めます。,授業内容の概略の理解を評価します。\\n筆記試験(およそ80%)とレポート(およそ20%)で評価します。,本科目はコアカリキュラムC7人体の成り立ちと生体機能の調節(1)人体の成り立ちに対応しています.\\n問題解決型の能動的学修に該当します.\\n医師免許をもち; 病理解剖業務経験がある教員が; その経験を活かして; ヒトの構造と機能の概要を指導します.
162555,3-4,月1,生化学 II,広瀬 豊,2,専門教育科目(必修) 生物系薬学,2,杉 大講義室,第1週  脂質と生体膜\\n第2週  脂質の消化.吸収と輸送、脂肪酸のβ酸化\\n第3週  脂肪酸の生合成と脂肪酸代謝の調節機構\\n第4週  コレステロール代謝\\n第5週  リポタンパク質代謝と疾患\\n第6週  アミノ酸代謝と尿素サイクル\\n第7週  アミノ酸代謝\\n第8週  窒素固定とアミノ酸生合成\\n第9週  ヌクレオチド代謝\\n第10週  遺伝子の基本構造と高次構造。クロマチンとDNAの構造。\\n第11週  遺伝子の複製・変異・修復\\n第12週  遺伝子の転写\\n第13週  遺伝子発現調節の意義、mRNAプロセシング(1)\\n第14週  mRNAプロセシング(2)\\n第15週  翻訳,期末試験(100%),薬学新コアカリキュラムのC-4-2-1); 2)、C-6-1-1)、C-6-4-1)、C-6-3-3)、C-6-4-1); 2) C-6-5-1); 2)に対応している。\\nまた、薬学旧コアカリキュラムのC4「人体の成り立ちと生体機能の調節」およびC6「生命現象の基礎」に対応している。\\n大学独自科目
162716,3-4,月1,分子遺伝動物学,高雄 啓三,3,専門教育科目(選択),2.0,杉 403講義室,スライド、配布資料に基づく講義を行う。\\n一部の講義は外部講師を招き、最先端の研究について学ぶ。\\n1回目	序論;  動物実験に関する法律;  倫理;  福祉(高雄)\\n2回目	遺伝子改変マウスを用いた行動解析の基本 (高雄)\\n3回目	実験動物の飼育管理・品質管理(動物実験施設 藤井一希)\\n4回目	神経科学研究におけるモデル動物としてのニホンザル(医 システム情動 瀬戸川剛)\\n5回目	動物実験に関わるカルタヘナ法 (遺伝子実験施設 田渕圭章)\\n6回目	動物実験における薬剤の投与経路・採血方法・麻酔 (遺伝子実験施設 田渕圭章)\\n7回目	研究例紹介:骨形成とメカニカルストレス (遺伝子実験施設 田渕圭章)\\n8回目	AAVベクターを用いた疾患モデルマーモセットの作出と遺伝子治療研究への応用(群馬大学 平井宏和)\\n9回目	研究例紹介:マウスの発生と発生工学的手法の利用(アイソトープ実験施設 安村美里)\\n10回目	研究例紹介:非臨床試験に向けたin silico解析(薬 医薬AI・データ科学講座 菅野亜紀)\\n11回目	研究例紹介:分子遺伝学ツールの生体機能研究への応用(福島県立医科大学 小林和人)\\n12回目	研究例紹介:遺伝子改変マウスを活用した神経・精神疾患研究(高雄)\\n13回目	毒性学における動物実験(分子・構造解析施設 平野哲史)\\n14回目	研究例紹介:腸管免疫とエピゲノム(富山県立大学 古澤之裕)\\n15回目	まとめと理解度テスト(高雄),学修意欲(約20%)、レポート(約40%)、筆記試験(約40%)により成績を付け、合否を判定する。,将来、創薬や医薬学の基礎研究を志す者にはぜひ積極的な参加を望みます。\\n臨床の現場に立とうとする者にも動物を用いた研究の論理を知り、将来に役立てて欲しい。
162887,3-4,月4,製薬企業と創薬,水口 峰之,3,専門教育科目(必修) 基盤教育,1,杉 403講義室,● 製薬企業で活躍する研究者(実務経験者)の講義を実施する(5回)。\\n各回の講師や内容は変更されることがありますので; 授業計画詳細情報および授業中のアナウンスで確認してください。\\n● 配属研究室の教員の指導の下で、5回の講義から興味を引かれたトピックを取りあげ、調査研究を行いレポートにまとめる。\\nレポート内容について、指導教員にプレゼンテーションしディスカッションする。\\n● 詳細なスケジュールやレポート提出については、別途指示する。\\n(授業計画詳細情報に記載の日程から変更される場合があるので、最新の学生掲示を確認すること),講義への意欲; 態度と提出レポートに基づき、教務委員会が成績評価を行う。\\nレポートおよび受講態度など取り組み姿勢により、総合的に評価する(100%)。\\nレポートには、題材とした元の講義を明記すること。記述内容の正確さ、調査の丁寧さや深さが、評価の目安となる。\\n「達成目標」に掲げた項目を達成しているものを60点以上、「達成目標」に掲げた項目を達成した上で、良好な成果を収めているものを70点以上、優れた成果を収めているものを80点以上、特に優れた成果を収めているものを90点以上とする。,なお、本講義は「 公益財団法人 田村科学技術振興財団」よりご支援を賜っております。\\n実務経験教育科目、問題解決型学習
168002,3-4,月2,東西医薬学II,条 美智子,3,専門教育科目(自由),2,杉 403講義室,1.  東洋医薬学の基本概念(担当:条)\\n2.  漢方薬の成立と剤型(担当:条)\\n3.  婦人科疾患の漢方治療(担当:条)\\n4.  神経疾患の漢方治療(担当:条)\\n5.  精神神経疾患の漢方治療(担当:条)\\n6.  消化器疾患の漢方治療(担当:条)\\n7.  腎泌尿器疾患の漢方治療(担当:条)\\n8.  肝胆膵疾患の漢方治療(担当:条)\\n9.  疼痛性疾患の漢方治療(担当:条)\\n10. 呼吸器疾患の漢方治療(担当:条)\\n11. 耳鼻咽喉科疾患と漢方治療(担当:条)\\n12. 皮膚疾患と漢方治療(担当:条)\\n13. がん治療における漢方治療の役割(担当:条)\\n14. 漢方薬の副作用(担当:条)\\n15. 伝統医学における医療倫理(担当:条),授業毎に実施する小テストにより成績評価を行う(100%)。,本科目は、「卓越薬学教育プログラム和漢薬コース」履修対象科目です。\\n本教科はコアカリキュラムC 基礎薬学 C-5 薬学の中の生薬学・天然物化学  C-5-1 生薬学・天然物化学の基礎、およびD 医療薬学 D-2 薬物治療につながる薬理・病態 D-2-19 漢方療法に対応し、薬剤師国家試験出題基準VII実務 薬剤師業務 現代医療の中の生薬・漢方薬に対応している。\\nコース生以外の履修も歓迎します。
161503,1-2,火1,有機化学 I,矢倉 隆之,2,専門教育科目(必修) 化学系薬学,2,杉 303講義室,第1回:ハロゲン化アルキルの構造・命名・反応性\\n第2回:ハロゲン化アルキル反応1\\n第3回:ハロゲン化アルキル反応2\\n第4回:ハロゲン化アルキル反応3\\n第5回:ハロゲン化アルキル反応4\\n第6回:ハロゲン化アルキル反応5(本学独自教育項目を含む)\\n第7回:置換反応および脱離反応の合成化学への応用(本学独自教育項目を含む)\\n第8回:第1回~7回のまとめ(演習; PBL)\\n第9回:アルコールの反応1\\n第10回:アルコールの反応2; エーテルの反応\\n第11回:エポキシド; アミンおよびチオール類の反応(本学独自教育項目を含む)\\n第12回:カルボン酸とカルボン酸誘導体の反応1\\n第13回:カルボン酸とカルボン酸誘導体の反応2\\n第14回:カルボン酸とカルボン酸誘導体の反応3(本学独自教育項目を含む)\\n第15回:第9回~14回のまとめ(演習; PBL)\\n期末試験\\n毎回、小テストとそれに基づく問題点を挙げ、議論する。\\n第8回および第15回は演習問題を基に学生からの疑問点を抽出して、それについて議論して解説する。\\n講義日程等はMoodleで確認してください。,演習成績(2回)約50%と期末試験(全範囲)成績約50%の総合点(100点満点)で評価する。演習; 試験では化学用語の習得と有機反応の理解を問う。総合点が60点以上で合格とする。演習や試験問題の難易度は上に示した問題集レベルから教科書の演習問題のレベルとする。問題集レベルをマスターできていれば合格レベルとする。,本教科は; コアカリキュラムC3化学物質の性質と反応(3)官能基の性質と反応の一部に対応する。授業計画詳細を参照。\\n大学独自項目; 問題解決型学習を含む。
161559,1-2,火1,衛生薬学I,櫻井 宏明,3,専門教育科目(必修) 衛生薬学,1,杉 大講義室,講義は以下の内容に分け、各教員がそれぞれの専門分野を分担する。\\n第1~4回 衛生薬学の概論および環境衛生の基礎(櫻井)\\n第5~8回 食品衛生の基礎(伊原),・期末試験(健康と環境)を行い、到達度を評価する。配点は、環境(50%)、および健康(50%)とする。,■対応するコアカリキュラム\\n新カリ:E-3-1、E-3-2\\n旧カリ:D1-(3)-1-1; 2; 3、D2-(1)-4-1; 2; 3; 4
161614,1-2,火1,生物薬剤学II,赤沼 伸乙,3,専門教育科目(必修) 医療薬学,1,杉 大講義室,第1週 ADME概論・消化管吸収(1)\\n第2週 消化管吸収(2)・消化管以外からの吸収\\n第3週 体内分布(1)\\n第4週 体内分布(2)\\n第5週 薬物代謝\\n第6週 排泄\\n第7週 薬物の相互作用\\n第8週 まとめ,期末試験により合否を判定する(100%)。この試験を通じて、「達成目標」に掲げた項目を達成していると判断された場合は60点以上を与える。「達成目標」内の項目を達成した上で、良好な成果を収めているものを70点以上、優れた成果を収めているものを80点以上、特に優れた成果を収めているものを90点以上と評する。,本教科は、令和4年度改定薬学教育モデル・コア・カリキュラム(R4コアカリキュラム) としてはD_医療薬学におけるD-4-1に該当する。なお、H25コアカリキュラムではE1の(1)と(6)、E3の(3)、E4の(1)に対応している。本授業内では問題解決能力を醸成するための教育を実施する。
