162853,3-4,水2,薬学英語 II,水口 峰之,2,専門教育科目(必修) 基盤教育,1,,第1-3週:研究室による講義\\n第4-6週:研究室による講義\\n第7-9週:研究室による講義\\n※3研究室にて、各3回ずつ講義が行われる。各研究室で行う講義内容は、担当研究室は違っていても統一した内容になっている場合があり、その中で課題に対するプレゼンテーションやその内容に関する学生同士のディスカッションが含まれる。なお、グループ分けは事前に決定し、新年度のガイダンス時に配布する。\\n第1-15週:英語学習システムによるオンデマンド学修(TOEIC演習),各研究室3回の授業を3回行うことで合計9回の授業を行う。\\n各研究室30点(30点×3=90点)および英語学習システムによるオンデマンド学修(10点)により採点する。\\n◯研究室による授業\\n評価基準\\n・英語力、および課題への取り組み態度等(遅刻することなく出席することを含む)\\n・発表、質疑応答等への参加意欲、態度\\n・グループ内でのディスカッションへの参加意欲、態度\\n◯英語学習システムによるオンデマンド学修\\n英語学習システムにおいて、自分の実力に対応したコースを選択し、演習を行なった上で、模擬試験を受験する。Moodle コースに提出した試験結果のスコアをもとに評価する。\\n評価は、「達成目標」に掲げた項目を達成しているものを60%以上、「達成目標」に掲げた項目を達成した上で、良好な成果を収めているものを70%以上、優れた成果を収めているものを80%以上、特に優れた成果を収めているものを90%以上とする。,学習方法は小グループ学習(PBL)であり、英語でのディスカッションやプレゼンテーションを頻繁におこなう。\\n専門分野ならびに薬学関連の職業に関する内容を含み、それらの関係を理解するキャリア教育と位置付ける。\\n本講義は、問題解決型学習であり、本学独自教育である。
161453,1-2,木2,物理化学II,中野 実,2,専門教育科目(必修) 物理系薬学,2,杉 303講義室,第1回  気体と熱力学第0法則:  温度、理想気体と状態方程式\\n第2回  熱力学第1法則(1):  仕事と熱\\n第3回  熱力学第1法則(2):  状態関数の完全微分、エンタルピー、比熱\\n第4回  熱力学第1法則(3):  ヘスの法則、標準生成エンタルピー\\n第5回  熱力学第2法則と第3法則:可逆過程と不可逆課程におけるエントロピー\\n第6回  熱力学第2法則と第3法則:熱機関、熱力学第3法則、自由エネルギー\\n第7回  物理平衡と化学平衡(1):クラペイロンークラウジウスの式、平衡定数\\n第8回  物理平衡と化学平衡(2):化学ポテンシャルと化学平衡\\n第9回  物質の3つの状態:    気体、液体、固体、相転移、相律\\n第10回 理想溶液と希薄溶液(1):濃度の表し方、ラウールの法則\\n第11回 理想溶液と希薄溶液(2):ヘンリーの法則、希薄溶液の束一的性質\\n第12回 反応速度論:       反応速度定数、反応次数、速度定数\\n第13回 複合反応:        可逆反応、並行反応、逐次反応\\n第14回 反応速度と温度:     アレニウスの式、触媒、吸着\\n第15回 衝突理論、遷移状態理論: 反応速度に影響を及ぼす諸因子\\n第16回 定期試験,定期試験100%とする。\\nこれにより、「達成目標」に掲げた項目を達成していると判断された場合は60点以上とする。「達成目標」に掲げた項目を達成した上で、良好な成果を収めているものを70点以上、優れた成果を収めているものを80点以上、特に優れた成果を収めているものを90点以上とする。,新コアカリ対応\\nC-1-3-1)〜3)\\nC-1-4-1);  2)\\n新コアカリ対応\\nC1-(2)-1- 1);  2)\\nC1-(2)-2- 1)~7)\\nC1-(2)-3- 1)〜5)\\nC1-(2)-4- 1)〜3)\\nC1-(2)-5- 1)~3)\\nC1-(2)-6- 1);  2)\\nC1-(3)-1- 1)〜3);  5)〜6)
161557,1-2,木4,実践薬学II,田口 雅登,3,専門教育科目(必修) 臨床薬学,1,杉 102講義室,第1週: 薬剤師の使命~地域包括ケア・多職種連携~ (講義・グループ討議)\\n第2週: セルフメディケーション・薬物乱用・自殺防止に関する啓発・教育 (講義・グループ討議)\\n第3週: 調剤過誤の原因分析とリスクマネジメント (講義・グループ討議)\\n第4週: 医療における説明義務、どう伝える? (講義・グループ討議)\\n第5週: 生涯学習・自己研鑽と次世代を担う人材育成 (講義・グループ討議)\\n第6週: 特別講義「患者のナラティヴとは何か?(仮題)」\\n第7週: 総合演習 グループ討議(まとめ)\\n第8週: 総合演習 グループ討議の成果発表(プレゼンテーション・総合討論)\\n総合演習では、受講者が毎週行ってきたグループ討論の成果(プロダクト)を発表し、意見交換を行う。,1.形成的評価:各授業ごとの質疑応答・討議への参加   :およそ40%\\n2.総括的評価:記述式試験(レポート、プレゼンテーション) :およそ60%\\n形成的評価は質疑・応答の頻度や内容に応じた加点方式とする。\\n総括的評価のうち、レポート評価はプロフェッショナルとしての薬剤師像について、グループ学習による学習効果、学習者の考え方、理解度について総合的に判断する。\\nまた、プレゼンテーション評価では、教員に加え、受講生(学生)による採点結果(同僚評価)を加味する。討議の場面における積極的発言(態度)も評価の対象とする。\\n総点で「達成目標」に掲げた項目を達成しているものを60点以上(可)、「達成目標」に掲げた項目を達成した上で、良好な成績を収めているものを70点以上(良)、さらに将来薬剤師として地域包括ケアなどの場面で、ファーマシューティカルケアを実践する意欲が感じられるものを80点以上(優)、次世代の薬剤師として最善の薬物治療への関わり方を探究しようとする科学的思考への意欲が感じ取れるものを90点以上(秀)とする。,本教科は主として薬学教育モデル・コア・カリキュラム(令和4年度改訂版)の大項目「B 社会と薬学」のB-1~B-5に対応する。 大項目Bの学修は、「A 薬剤師として求められる基本的な資質・能力」に定義された修得すべき能力(学習目標)の正しい理解に繋がる。\\nまた、国家試験出題基準のうち【法規・制度・倫理】(プロフェッショナリズム、薬学と社会)【実務】(薬学臨床基本事項)に対応する。
161612,1-2,木1,薬理学II,久米 利明,3,専門教育科目(必修) 医療薬学,1,杉 大講義室,プリントあるいはスライドを使用して講義する.\\n(1)循環器系疾患の薬1~3\\n(2)血液・造血器系疾患の薬\\n(3)呼吸器系疾患の薬\\n(4)免疫・炎症・アレルギー疾患の薬\\n(5)泌尿器系疾患の薬\\n(6)内分泌系疾患の薬,期末試験(100%)により合否を判定する。\\n(評価基準:設定した問題内容を理解し; 正しい解答を導き出せるか),E2(2)~(3)、E2(4)1、3、E2(5)23
161721,1-2,木2,医療統計学,原 朱音,6,専門教育科目(選択),2,杉 403講義室,1)医療分野における統計解析・データ解析の活用\\n2)記述統計:データ表現による情報伝達\\n3)推測統計:基本的な統計解析の復習\\n4)相関関係・因果関係\\n5)多変量解析\\n6)観察的疫学研究\\n7)介入研究\\n8)交絡とバイアス\\n9)臨床データの取り扱い\\n10)生存時間解析\\n11)リスクの評価\\n12)診断能の評価\\n13)医療分野における機械学習 ※オンデマンド型実施\\n14)論文読解グループワーク\\n15)論文読解の発表会,論文読解発表会での発表内容の評価(30点)、期末考査(70点)の得点を合計し、100点満点で評価を行う。60点以上を可とする。\\n評価基準:講義内容を正しく理解し; 要求されている課題に解答できているかを評価する。,本授業の内容は、薬学教育モデル・コアカリキュラム平成25年度改訂版のE3-(1)-4;  E3-(1)-5;  E3-(1)-6の項目に該当する。第13回「医療分野における機械学習」は独自項目に該当する。
161722,1-2,木4,臨床倫理学,田口 雅登,3,専門教育科目(必修) 臨床薬学,1,杉 403講義室,1~3回目 医療・生命倫理に関する講義・小グループディスカッション\\n4~6回目 研究倫理に関する講義・小グループディスカッション\\n7、8回目 倫理観の醸成に資するグループワーク,学修態度(70%;ケーススタディへの取り組み姿勢)と期末レポート(30%)により、総合的に評価する。\\n評価の具体的な基準は、ケーススタディについては「達成目標」に掲げられた(あるいは「キーワード」として提示された)事項を適切に理解できているかであり、期末レポートについては学修成果を「自身の言葉で説得的に記述できているか」である。,1 B(1)4; 5;F(1)21; 2; 3\\n2 A(2)11; 2; 3; 4\\n3 A(2)21; 2; 3;F(2)24\\n4 A(2)31; 2;F(1)25\\n5 A(2)33; 4;F(1)26; 7\\n6 A(2)13;F(1)24; 5; 6; 7;問題解決型学習\\n7 A(2)13;F(1)24; 5; 6; 7;問題解決型学習\\n8 A(2)41; 2; 3;G(2)1; 2; 3
161881,1-2,木3,ケミカル・バイオロジーI,千葉 順哉,3,専門教育科目(選択),2,杉 403講義室,第 1週:糖質1\\n第 2週:糖質2\\n第 3週:糖質3\\n第 4週:糖質4\\n第 5週:糖鎖のケミカルバイオロジー\\n第 6週:分子間相互作用と化学進化\\n第 7週:脂質1\\n第 8週:脂質2\\n第 9週:脂質3\\n第10週:脂質のケミカルバイオロジー\\n第11週:核酸1\\n第12週:核酸2\\n第13週:核酸3\\n第14週:核酸のケミカルバイオロジー1\\n第15週:核酸のケミカルバイオロジー2,期末試験(100%)により評価する。,本教科は新コアカリキュラムの\\nC-1-1-2)      「C1(1)」\\nC-3-1-1); C-3-1-2) 「C3(1)」\\nC-3-3-2)      「C3(3)」\\nC-4-2-1)      「C4(2)」\\nC-6-2-1)      「C6(2)」\\nに対応する。「」内には; 対応する旧コアカリキュラムの番号を示す。\\nまた5回相当のアドバンスト教育内容を含む。
162503,1-2,木2,有機化学 III,山田 強,3,専門教育科目(選択),2.0,杉 大講義室,第1回:有機金属化合物(12章)\\n第2ー4回:ラジカル・アルカンの反応(13章)\\n第5回:アミンの合成と反応(20章)\\n第6ー7回:酸化と還元(教科書全般)\\n第8回:中間試験および解説(到達度チェックと解説によるフィードバックを行うことで、自己学習が啓発される)\\n第9ー10回:合成高分子(27章)\\n第11ー13回:ペリ環状反応(28章)\\n第14ー15回:工業的実用化を指向した化学\\n第16回:期末試験,中間試験(50%)および期末試験(50%)、2回の筆記試験により成績評価を行う。100点満点中、60点以上を合格とする。,本科目の一部は、コアカリキュラム C3化学物質の性質と反応(1)化学物質の基本的性質、(2)有機化合物の基本骨格の構造と反応、(3)官能基の性質と反応、の一部に対応している(授業計画詳細を参照)。\\nまた、問題解決型学習を含み、本科目の大部分(13コマ相当)は、アドバンスト教育内容に相当する。
162721,1-2,木1,病院薬学,新田 淳美,4,専門教育科目(必修) 臨床薬学,2.0,杉 402講義室,以下の12の病院のうち1つへインターンシップ形式にて半日の見学を実施する。\\n(富山赤十字、市立砺波総合、済生会高岡、北陸中央、富山労災、厚生連高岡、黒部市民、高岡市民、富山市民、金沢医大氷見市民、県立中央、南砺中央)\\nそれぞれの病院から非常勤講師にきていただき、事前説明を受け、翌週にはインターンシップとして、半日の薬剤師1日経験をする。\\nインターンシップ翌週には、見学してきたことを発表する。お互いの発表内容も定期試験の内容に含める。\\n適宜、課題やTBLを課すので、指示を受けた日時までに対応すること。\\n上記以外の内容については、授業計画に記載しているので、よく読み講義場所や服装、準備すべき物品や注意事項に留意すること。,期末試験(70%)、講義や病院見学での態度や成果物および講義受講態度も加味する(30%)。なお、薬学部内規に従い、15回の授業のうち5回以上欠席した場合には、単位を認めない。,薬学改訂コアカリにおける代表的な疾患とは、がん、高血圧症、糖尿病、心疾患、脳血管障害、精神神経疾患、免疫・アレルギー疾患、感染症とする。\\n本科目は、病院薬剤師として7年半の勤務経験を有する実務教員である新田淳美が担当する。\\n薬剤師1日体験、TDM測定の実際、病態による輸液の実際など、大学独自項目を含む。
161403,3-4,木3; 木4; 木5,製薬企業概論,水口 峰之,1,専門教育科目(必修) 基盤教育,1,五福共C11番教室,● 医薬品の品質管理に関する講義(1回)。\\n● 製薬企業に勤務されている講師による講義および講義の内容についてのディスカッションとプレゼンテーション(4回)。(問題解決型学習・小グループ学習PBL),提出するプレゼンテーションのファイル(約60%)および受講態度など取り組み姿勢(約40%)を基準に評価する。\\nプレゼンテーションのファイルは、講義の内容について、(1)魅力に感じた点、疑問に思った点、(2)今後の自分にどう生かせるか、の記述を評価の目安とする。,コアカリ B-1-1;  3)、B-4-1;  1); 2); 3)、B-4-2;  1); 2)、B-4-3;  1); 2) の内容に相当する。\\n他は大学独自項目である。\\n学習方法は、問題解決型学習(小グループ学習PBL)を含んでいる。\\n実務経験教員科目
162454,3-4,木2,生物物理化学,清水 貴浩,2,専門教育科目(必修) 物理系薬学,2,杉 大講義室,第1週 生体膜の構造と機能(問題解決型学習を含む)\\n第2週 膜輸送タンパク質(問題解決型学習を含む)\\n第3週 生命現象とイオン(問題解決型学習を含む)\\n第4週 Bornエネルギー(独自教育を含む)\\n第5週 束一的性質と浸透圧平衡\\n第6週 ドナン膜平衡の基礎と応用(独自教育と問題解決型学習を含む)\\n第7週 緩衝溶液(問題解決型学習を含む)\\n第8週 アミノ酸の解離、蛋白質のアミノ酸残基の解離(問題解決型学習を含む)\\n第9週 リン酸の解離平衡、ATP加水分解反応と自由エネルギー\\n第10週 巨大分子(問題解決型学習を含む)\\n第11週 協同的結合と独立な結合\\n第12週 拡散(問題解決型学習を含む)\\n第13週 消化器の薬物生理学(独自教育を含む)\\n第14週 細胞の恒常性に関する生物物理(独自教育を含む)\\n第15週 総括,本試験の成績に基づき; 成績評価を行う(100%)。本試験は主として; 記述問題で; ノートの持ち込みはない。「履修上の注意」の繰り返しになりますが、本試験後の; 参考試験や追試験等は原則行わないので; 受講態度には十分に注意されたい。,大学独自教育や問題解決型学習を含む。問題解決型学習に関しては; 講義内容に関連する計算問題を解き; 自らで実例を理解する。コアカリキュラムとの対応は、授業計画詳細情報に記載。
162602,3-4,木1,薬理学III,久米 利明,3,専門教育科目(必修) 医療薬学,1,杉 403講義室,プリントあるいはスライドを使用して講義する.\\n(1)中枢神経系の疾患の薬2~4\\n(2)代謝系疾患の薬1~2\\n(3)消化器系疾患の薬1~2\\n(4)授業の振り返り及びテスト\\n各回において、各疾患の病態およびその治療薬の臨床応用についても併せて講義を行う(大学独自科目)。,期末試験(100%)\\n(評価基準:設定した問題内容を理解し; 正しい解答を導き出せるか),各回において、各疾患の病態およびその治療薬の臨床応用についても併せて講義を行うため、大学独自科目と位置づけている。\\nD-1-1 1); 2);  D-1-3 1);  2);  D-2-1;  D-2-3;  D-2-4;  D-4-1\\n(旧コアカリ E2(1)3、4、E2(2)3、4、E2(4)2、3、E2(5)1、3)
162608,3-4,木1,病態薬物治療学 I,新田 淳美,3,専門教育科目(必修) 医療薬学,1.0,杉 403講義室,講義を中心とし、必要に応じてプリントとスライド等を使用する。演習問題を配布し、演習形式での知識を深める。\\n12月10日 【講義】薬物乱用、依存症 (新田)\\n12月17日 【講義】感染症 (新田)\\n12月24日 【講義】血液・造血器疾患(1)貧血 (新田)\\n1月7日  【講義】血液・造血器疾患(2)凝固異常 (新田)\\n1月14日  【講義】血液・造血器疾患(3)白血病、リンパ腫 (新田)\\n1月21日 【講義】終末期医療・緩和医療 (新田)\\n1月28日 【講義】眼疾患 (横瀬)\\n2月・補講期間中 【講義】皮膚疾患 (横瀬),期末試験(70%)と講義にとりくむ態度(30%)で評価を行う。全体で60%以上を得ることを単位取得の基準とする。薬学部の規定に従い3回以上、欠席の場合は、定期試験の受験を不可とする。,本科目は、「問題解決型学習」である。\\n内容には、大学独自項目も含まれる。また、薬学部・改訂コアカリの内容を含んでおり授業詳細にSBOを記載している。\\n新カリにおける以下をカバーし、大学独自項目も含んでいる。\\nC-2-7;   D-1-3;   D-2-1;  D-2-7;  D-2-9;  D-2-15;  D-2-17;  D-2-18
162705,3-4,木1,細胞生物学,宗 孝紀,2,専門教育科目(必修) 生物系薬学,2.0,杉 大講義室,第1回 細胞の構築とオルガネラ(宗)\\n第2回 タンパク質の選別輸送とオルガネラの形成(宗)\\n第3回 小胞体・ゴルジ装置におけるタンパク質の選別輸送と疾患(宗)\\n第4回 ミトコンドリア、ペルオキシソームの形成と機能と疾患(宗)\\n第5回 リソソーム、エンドソームの機能と疾患(宗)\\n第6回 細胞内及び生体内の脂質輸送(守田)\\n第7回 脂質代謝の調節機構(守田)\\n第8回 生体膜を介した物質輸送(宗)\\n第9回 膜輸送体の機能と疾患(宗)\\n第10回 シグナル伝達の一般原理(櫻井)\\n第11回 受容体の構造と機能_1(櫻井)\\n第12回 受容体の構造と機能_2(櫻井)\\n第13回 細胞増殖と細胞死のメカニズム(櫻井)\\n第14回 シグナル伝達異常による発がん(櫻井)\\n第15回 代表的なシグナル経路と医薬品(櫻井),期末試験の点数により評価する (100%)。,本科目は、以下の内容を含む。\\n新コアカリキュラムC-6-1 、C-6-4 、C-6-5 、C-6-6 、C-6-7 、D-2-16 の一部の内容に対応している。\\n旧コアカリキュラム C6-(1) 、C6-(2) 、C6-(3) 、C6-(4) 、C6-(5) 、C6-(6) 、C6-(7) の一部の内容に対応している。\\nまた、3コマ分のアドバンス教育内容を含む。
162712,3-4,木2,天然医薬資源学,李 貞範,3,専門教育科目(選択),2,杉 403講義室,第1週 天然医薬資源学に関するイントロダクション\\n第2週 天然物の取り扱い(1)\\n第3週 天然物の取り扱い(2)\\n第4週 天然物の分類と生合成\\n第5週 脂質およびポリケチド\\n第6週 フェニルプロパノイドおよび関連化合物\\n第7週 フラボノイドおよび関連化合物\\n第8週 テルペノイドおよび関連化合物\\n第9週 テルペノイドおよび関連化合物\\n第10週 アルカロイドおよび関連化合物\\n第11週 アルカロイドおよび関連化合物\\n第12週 微生物が生産する天然物\\n第13週 薬理作用に基づく天然物の分類\\n第14週 香料や化粧品として用いられる天然物\\n第15週 生合成工学による天然物の生産\\n第15回の内容に大学独自項目を含む。,期末試験により合否を判定する(100%)。\\n評価は、「達成目標」に掲げた項目を達成しているものを60点以上、「達成目標」に掲げた項目を達成した上で、良好な成果を収めているものを70点以上、優れた成果を収めているものを80点以上、特に優れた成果を収めているものを90点以上とする。,本教科は平成25年度改訂コアカリキュラム C5 自然が生み出す薬物 (2) 薬の宝庫としての天然物、に対応する。令和4年度改訂コアカリキュラム C5 薬学の中の生薬学・天然物化学やC-2-6-1);  C-3-4-1)~2);  B-3-3-3)に対応する。\\n第15回の内容に大学独自項目を含む。詳細は「授業計画詳細」に記載。\\n本講義は問題解決型学習である。
161401,1-2,金3; 金4; 金5,薬学概論,水口 峰之,1,専門教育科目(必修) 基盤教育,1,五福共C11番教室,● 薬学部長による講義(1回)。\\n● 学内の教員が、薬学部生としての礼儀と誠心、思いやりの精神、大学生活に取り組む姿勢、薬学の面白さ等に関する講義を行う(2回)。\\n● 各研究室に分かれ小グループにて、薬学部に対するなんでもQ&Aを実施する(2回)。(問題解決型学習・小グループ学習PBL)\\n● 製薬企業、病院・薬局に勤務されている講師による、各業務等に関する講義を行う。\\n● 学内の薬学系研究室を訪問し、実際の研究を見学・体験すると同時に、先輩や教員たちと交流する。(問題解決型学習・小グループ学習PBL)\\n●研究倫理についての導入教育(講義)を行う。\\n●研究室なんでもQ&A、研究室訪問、製薬企業または病院・薬局訪問の具体的なスケジュールは、ガイダンスで配布される資料を参照すること。,レポート(約80%)および受講態度など取り組み姿勢(約20%)により、総合的に評価する。\\nレポートは、講義、見学、訪問で見聞した内容について、(1)感じたことや気付かされたこと、(2)今後の自分にどう生かせるか、の記述を評価の目安とする。\\n「達成目標」に掲げた項目を達成しているものを60点以上、「達成目標」に掲げた項目を達成した上で、良好な成果を収めているものを70点以上、優れた成果を収めているものを80点以上、特に優れた成果を収めているものを90点以上とする。,本講義中; 病院・薬局訪問は; コアカリ F-1-1;  1) の内容に相当する。\\n他は大学独自項目である。\\n学習方法は、問題解決型学習(小グループ学習PBL)を含んでいる。\\n実務経験教員科目
161402,1-2,金2,医療学入門,高村 昭輝,1,専門教育科目(必修) 基盤教育,1,五福共C21番教室; その他,2つのユニットに分けて実施する。*外部講師および施設の都合により日程の移動変更あり\\n講義、グループ討論と全体討議、演習または実習を組み合わせる。\\n医療関係者および講師の講演を聴き、与えられた課題についてレポートを提出する。\\nユニット4 医療と社会\\n医療と社会(外部講師)、講義\\n医療と社会、薬害と社会(外部講師)、講義、全体討論\\n医療と社会(外部講師)、講義\\n医療と社会(外部講師)、講義、全体討論\\nユニット5\\n早期介護体験実習オリエンテーション\\n早期介護体験実習(学外施設)\\n実習後\\n早期介護体験実習事後グループワーク、発表、プレゼンテーション,(全体)100%\\n全体で3分の2以上出席している者、心肺蘇生講習の授業修了者を評価する。\\n各ユニットは各ユニット毎に3分の2以上出席している者を評価する。\\nレポートによる評価を総合的に評価する。\\n5ユニットの評価点を合計して評価する。\\n定められた期限までに課題・レポートの提出を行わない場合には単位を付与しません。正当な理由なく、実習前オリエンテーション、実習、実習後グループワークと発表の授業を欠席した場合には単位を付与しません。\\n評価者(評価作成者):担当教員に記載の教員\\n(ユニット4)20%\\nレポートによる評価。レポートは課題に対して; 自分はどのように考えるのかを述べることができることを基準に判断する\\n(ユニット5)20%\\n1.	実習発表の実施\\n2.	実習報告書の作成と提出\\n受入施設の指導員による実習学生の行動、意識、態度からの個別評価を行う。,学習方法は、医学部(医学科; 看護学科)薬学部(薬学科、創薬科学科)とともにPBL; SGDを取り入れ、介護体験実習の報告としてグループでプレゼンテーションする。
