154070,3-4,金4,生命倫理学,宮島 光志,3,専門教育科目 看護基礎科学,1,,オンデマンド配信の講義を主としますが、各種のWeb動画を用いた自修(多種多様なケーススタディ)にも取り組んでもらいます。\\n1.[導 入]professionalismとintegrity\\n2.[歴史1]倫理思想と人権思想の歩み\\n3.[歴史2]生命倫理と研究倫理の歩み\\n4.[体系1]生命倫理の4原則と15原則\\n5.[体系2]各種規範文書の構成と特色\\n6.[事例1]生命の誕生と心身の統合性\\n7.[事例2]人生の終焉と生涯の物語り\\n8.[総 括]定期試験+生命倫理とSDGs,受講(オンデマンド視聴)確認の「ふり返り」コメント全7回(20%;受講から1週間以内にMoodleで提出)と定期試験(80%;英文に関する出題も含む)により、総合的に評価します。\\n成績評価の具体的な基準は、上記の「達成目標」にどのくらい到達できているか、主要な「キーワード」を正確に理解できているかなどです。,
154130,3-4,金5,社会福祉学,西谷 美幸,2,専門教育科目 看護基礎科学,1,杉 11講義室,教科書に沿って講義し、配布資料なども活用する。\\n1-2週    社会福祉の歴史\\n3-5週    社会保障制度と社会福祉\\n6-9週    医療保障・介護保障・所得保障\\n10-13週  社会福祉の分野とサービス\\n14-15週  社会福祉実践と医療・看護\\n16週     まとめ・期末試験,中間試験50%+期末試験50%,
154150,3-4,金3; 金4,疫学,関根 道和,3,専門教育科目 看護基礎科学,1,杉 大講義室,講義および演習形式。\\n第1回から8回まで。授業計画詳細を参照のこと。,授業内レポート 0-10%\\n<評価基準>各授業内容を正しく理解しているか\\n筆記試験 90-100%\\n不合格者に対する再評価(再試験)は原則1回\\n評価者(評価作成者):「担当教員」に記載の教員\\n試験問題開示や解答公開の有無:無\\n理由:本科目では過去問題を利用した学修を推奨していないため,講義の順番は、教員の出張等の関係で変更になる可能性があります。\\n水平統合(社会医学実習および富山医療学)
154180,3-4,金1; 金2; 金3; 金4; 金5,看護方法論I,西谷 美幸,1,専門教育科目 看護学,3,杉 看護実習室; 五福共D22番教室,講義、グループワークおよび、演習\\nスケジュール\\n第1-2回   看護技術とは\\n第3-7回   観察の技術\\n第8-9回     記録報告・安全・安楽の技術\\n第10-13回  コミュニケーションの技術\\n第14-18回  環境をととのえる技術\\n第19-26回  運動と休息への援助技術\\n第27-30回  応用技術\\n集中              既修得した看護技術の学生間相互評価\\n集中と個別試験    実技試験,・目標毎の成績への寄与率は、区分しない\\n・上記の達成目標について、下記の方法で評価する\\n課題への取り組み状況(50% 課題提出、グループ活動の状況):目標1~15\\n実技試験(30% 課題について看護実践としての実施を評価する):目標1~10、13\\nレポート(20% 看護技術の根拠を調べ考えられていること、自分の看護実践を振り返ることができていること):目標1~15\\nなお、評価のフィードバックについては、記録用紙での助言、個別に質問を受ける、実技試験での個別指導等で行う,
154385,3-4,金2,成人看護論IV,山田 理絵,3,専門教育科目 看護学,2,杉 22講義室,授業の形式:講義と演習\\n第1・2回:慢性の病いをもつ生活者の看護\\n第3・4回:慢性の病いをもつ生活者を支える看護理論\\n第5-7回:慢性の病いをもつ生活者の薬物治療\\n第8-14回:慢性の病いをもつ生活者の看護過程の展開\\n第15回:慢性の病いをもつ生活者への教育・コーチング,評価に対する全ての目標の寄与率は同等です\\n慢性の病いをもつ事例のレポートおよび看護過程の展開の課題30%\\n評価基準は、慢性の病いをもつ生活者の身体; 心理; 社会; 価値観を総合的に捉えたアセスメントを行うことができるという視点で評価する\\n看護過程の展開の課題の締め切り日は; 2026年12月25日(金)13時です。\\n表紙(学籍番号と氏名を記載)をつけて; ホッチキスで留めて; 研究室のボックスに提出。\\n確認問題の課題70%,評価のフィードバックは; 疑問・質問を受け付け; 個別面談を行う。
154510,3-4,金2; 金3,母性看護論,二川 香里,2,専門教育科目 看護学,3.0,杉 11講義室,1.家族中心のケア  妊娠期のケア1\\n2.家族中心のケア  妊娠期のケア2\\n3.家族中心のケア  妊娠期のケア3\\n4.妊娠期における正常からの逸脱1\\n5.妊娠期における正常からの逸脱2\\n6.家族にとっての出産体験1\\n7.家族にとっての出産体験2\\n8.家族にとっての出産体験3\\n9.分娩期の異常への看護\\n10.家族中心のケア  産褥期のケア1\\n11.家族中心のケア  産褥期のケア2\\n12.家族中心のケア  産褥期のケア3\\n13.産褥期の正常からの逸脱とケア\\n14.家族中心のケア  新生児期のケア1\\n15.家族中心のケア  新生児期のケア2\\n16.新生児期の異常のケア\\n17.妊娠期・分娩期のまとめ\\n18-20.妊婦・褥婦・新生児のケアに必要な技術\\n21.妊婦・褥婦・新生児のケアに必要な技術試験\\n22-25.母子看護過程の展開について\\n26.母子看護過程の展開 解説、 個別返却,筆記試験: 妊娠期、分娩期、産褥期、新生児期  50%\\n達成目標(1)~(16)の評価への寄与率は同等とする。\\n課題レポート:事例の看護過程展開           25%\\n技術試験                                                      25%\\n課題レポート(看護過程展開)の評価基準\\n・情報を整理し記述してあること\\n・情報をエビデンスを用いて分析し、事例に合わせて統合していること\\n・適切な表現で看護問題・課題が表記されていること\\n・目標は対象が主語となる表現で、評価可能な表記がされていること\\n・事例にあった看護計画がされていること\\n・看護過程に連続性・一貫性があること\\n技術試験の評価基準\\n・ケア項目の目的が適切に言える\\n・身だしなみが整っている\\n・必要物品の準備ができる\\n・一通りの手順が正確である\\n・手技が的確である\\n・不必要な露出を避けるなど、プライバシーへの配慮ができる\\n・看護者らしい声掛けができる\\n・時間内に手早くできる など,
154565,3-4,火4; 金3,ヘルスケアシステム論II,髙倉 恭子,3,専門教育科目 看護学,2,杉 22講義室,原則、対面による講義\\n授業は、非常勤講師と本学教員による。但し、以下の回(日程)において、変更が生じた際は、連絡をする。\\n1回:社会保障制度と国・地方自治体の課題(担当:非常勤講師)\\n2回:感染症対策(担当:非常勤講師)\\n3回:学祭準備(休講)※対応は、講義時に説明\\n4回:母子保健対策(担当:非常勤講師)\\n5回:医療安全(担当:看護学科教員)\\n6回:難病対策(担当:非常勤講師)\\n7回:精神疾患を有する人々の特性と生活上の課題支援(担当:医学科教員)\\n8回:地域で暮らす精神障がい、精神疾患を有する人々の社会支援(担当:非常勤講師)\\n9回:地域包括支援センターにおける生活困難者の支援(担当:非常勤講師)\\n10回:歯科(口腔)保健対策(担当:医学科教員)\\n11回:エコチル事業から捉えた子どもの健康に関する課題と対策(担当:医学科教員)\\n12回:※メディアデー\\n13回:高齢者保健福祉対策「認知症対策」(担当:看護学科教員)\\n14回:児童の社会福祉対策(担当:非常勤講師)\\n15回:学びのまとめ(担当:髙倉),・ 科目担当者が提示する課題レポート (80%)にて評価する。評価基準は「設定した課題を正しく理解した上で、参考資料等も活用し、課題に対する自分の考えを記述できる」「その記述は、理論的かつ、読み手に伝わる文章構成」とする。\\n・各授業を聴講し記述する学びのレポート (20%)にて評価する(評価基準:講義の内容について、自らの考察も交えて、意見や学んだことを述べる。また、箇条書きの羅列ではなく、学習内容を他者に伝わることも意識し、文章で記述する)。\\n・評価について、質問があれば受け付ける。,・授業で提示された事業の背景等の詳細、各制度の詳細、保健や医療の活動に携わる各専門職の役割等については、教科書等を活用し、内容の確認を積極的に行って下さい。\\n・外部講師の都合等により、授業の順番や内容変更が生じた際は、moodle又は、授業時に連絡をします。
